{
  "id": "cybersecurity-club",
  "name": "Cybersecurity Club",
  "description": "A closed student group focused on cybersecurity topics, networking, and professional development for WGU cybersecurity students and alumni.",
  "category": "Technology",
  "url": "https://cm.wgu.edu/t5/Cyber-Security-Club/cmp-p/grouphub:cybersecurityclub",
  "type": "closed",
  "access_requirements": "Membership may be restricted or require approval",
  "target_audience": "WGU students and alumni interested in cybersecurity"
}
