{
  "id": "scta-wgu-chapters",
  "name": "SCTA - WGU Chapters",
  "description": "Student Chapter of the Technology Association for WGU students pursuing teaching careers in technology education. This is a closed group for future and current technology teachers.",
  "category": "Education",
  "url": "https://cm.wgu.edu/t5/SCTA-WGU-Chapters/cmp-p/grouphub:SCTAclub",
  "type": "closed",
  "access_requirements": "Must be pursuing or working in technology education/teaching",
  "target_audience": "WGU students and alumni in education programs with focus on technology instruction"
}
